sentence;maintopic;subtopic;subsubtopic
Was sind Aktien?;aktien;Aktien Erklärung;
Erkläre mir Aktien.;aktien;Aktien Erklärung;
Kannst du mir sagen was Aktien genau sind?;aktien;Aktien Erklärung;
Warum emittieren Unternehmen Aktien?;aktien;Aktien Erklärung;
Was wären alternative Investitionsformen?;Alternative Anlagen;Alternative Anlagen Erklärung;
Was sind alternative Investitionsoformen?;Alternative Anlagen;Alternative Anlagen Erklärung;
Ich möchte in alternative Investition in meinem Portfolio.;Alternative Anlagen;Alternative Anlagen Erklärung;
Ich möchte in Luxuswagen investieren.;Alternative Anlagen;Alternative Anlagen Erklärung;
Ich möchte in Old-Timer investieren.;Alternative Anlagen;Alternative Anlagen Erklärung;
Ich möchte in Pokemon Karten investieren.;Alternative Anlagen;Alternative Anlagen Erklärung;
Ich möchte in Sammelobjekte investieren.;Alternative Anlagen;Alternative Anlagen Erklärung;
Ich möchte in Luxusuhren investieren.;Alternative Anlagen;Alternative Anlagen Erklärung;
Ich möchte in Kunst investieren.;Alternative Anlagen;Alternative Anlagen Erklärung;
Ich möchte ein Gemälde kaufen.;Alternative Anlagen;Alternative Anlagen Erklärung;
Ich möchte in Güter investieren.;Alternative Anlagen;Alternative Anlagen Erklärung;
Ich möchte Rohstoffe kaufen.;Alternative Anlagen;Alternative Anlagen Erklärung;
Was sind Vorteile von alternativen Investitionen?;Alternative Anlagen;Alternative Anlagen Erklärung;
Was sind Nachteile von alternativen Investitionsformen?;Alternative Anlagen;Alternative Anlagen Erklärung;
Was sind Vorteile von alternativen Investitionsformen?;Alternative Anlagen;Alternative Anlagen Erklärung;
Was sind Nachteile von alternativen Investitionen?;Alternative Anlagen;Alternative Anlagen Erklärung;
Was wären alternative Anlagen?;Alternative Anlagen;Alternative Anlagen Erklärung;
Was sind alternative Anlagen?;Alternative Anlagen;Alternative Anlagen Erklärung;
Ich möchte in alternative Anlagen in meinem Portfolio.;Alternative Anlagen;Alternative Anlagen Erklärung;
Was haben alternativen Anlagen für Vorteile?;Alternative Anlagen;Alternative Anlagen Erklärung;
Was haben alternativen Anlagen für Nachteile?;Alternative Anlagen;Alternative Anlagen Erklärung;
Was sind Derivate?;derivate;Derivate Erklärung;
Was sind Futures?;derivate;Derivate Erklärung;
Was sind Options?;derivate;Derivate Erklärung;
Was sind Forwards?;derivate;Derivate Erklärung;
Was sind Termingeschäfte?;derivate;Derivate Erklärung;
Was sind Optionsgeschäfte?;derivate;Derivate Erklärung;
Was sind Swaps?;derivate;Derivate Erklärung;
Ich möchte in Derivate investieren.;derivate;Derivate Erklärung;
Ich möchte Derivate kaufen.;derivate;Derivate Erklärung;
Ich möchte in Futures investieren.;derivate;Derivate Erklärung;
Ich möchte Futures kaufen.;derivate;Derivate Erklärung;
Ich möchte in Options investieren.;derivate;Derivate Erklärung;
Ich möchte Options kaufen.;derivate;Derivate Erklärung;
Ich möchte in Forwards investieren.;derivate;Derivate Erklärung;
Ich möchte Forwards kaufen.;derivate;Derivate Erklärung;
Ich möchte in Termingeschäfte investieren.;derivate;Derivate Erklärung;
Ich möchte Termingeschäfte kaufen.;derivate;Derivate Erklärung;
Ich möchte in Optionsgeschäfte investieren.;derivate;Derivate Erklärung;
Ich möchte Optionsgeschäfte kaufen.;derivate;Derivate Erklärung;
Ich möchte in Swaps investieren.;derivate;Derivate Erklärung;
Ich möchte Swaps kaufen.;derivate;Derivate Erklärung;
Was sind die Watte?;derivate;Derivate Erklärung;
rivat;derivate;Derivate Erklärung;
privat;derivate;Derivate Erklärung;
Was sind Devisen?;devisen;Devisen Erklärung;
Was ist eine Devise?;devisen;Devisen Erklärung;
Wie erziele ich Gewinn mit einer Devise?;devisen;Devisen Erklärung;
Was sind Fremdwährungen?;devisen;Devisen Erklärung;
Warum verändert sich der Kurs von Fremdwährungen?;devisen;Devisen Erklärung;
Warum verändert sich der Kurs von Devisen?;devisen;Devisen Erklärung;
Wie erziele ich Gewinn mit Fremdwährungen?;devisen;Devisen Erklärung;
Was sind die Wiesen?;devisen;Devisen Erklärung;
Was ist eine die Wiese?;devisen;Devisen Erklärung;
Wie erziele ich Gewinn mit einer die Wiese?;devisen;Devisen Erklärung;
Warum verändert sich der Kurs von die Wiesen?;devisen;Devisen Erklärung;
Was sind Edelmetalle?;edelmetalle;Edelmetalle Erklärung;
Wie kann ich in Edelmetalle investieren?;edelmetalle;Edelmetalle Erklärung;
Ich möchte Gold kaufen.;edelmetalle;Edelmetalle Erklärung;
Ist es eine gute Idee, in Gold zu investieren?;edelmetalle;Edelmetalle Erklärung;
Ich möchte mein Gold verkaufen.;edelmetalle;Edelmetalle Erklärung;
Ich möchte Gold und Silber kaufen.;edelmetalle;Edelmetalle Erklärung;
Kann man auch in Gold investieren?;edelmetalle;Edelmetalle Erklärung;
Würde es sich lohnen, in Edelmetalle zu investieren?;edelmetalle;Edelmetalle Erklärung;
Was ist Forex?;devisen;Forex Erklärung & Devisenhandel;
Was kann ich auf Forex machen?;devisen;Forex Erklärung & Devisenhandel;
Wie kann ich Devisen kaufen?;devisen;Forex Erklärung & Devisenhandel;
Wo kann ich Devisen kaufen?;devisen;Forex Erklärung & Devisenhandel;
Wo kann ich Fremdwährungen kaufen?;devisen;Forex Erklärung & Devisenhandel;
Wie kann ich Fremdwährungen kaufen?;devisen;Forex Erklärung & Devisenhandel;
Wo kann ich Fremdwährungen verkaufen?;devisen;Forex Erklärung & Devisenhandel;
Wie kann ich Devisen verkaufen?;devisen;Forex Erklärung & Devisenhandel;
Ich möchte ein Grundstück kaufen.;immobilien;Immobilien Erklärung;
Ich möchte in Immobilien investieren.;immobilien;Immobilien Erklärung;
Ich will Immobilien kaufen die über die Jahre an Wert gewinnen.;immobilien;Immobilien Erklärung;
Ich möchte als Vermieter agieren und meine Liegenschaft vermieten.;immobilien;Immobilien Erklärung;
Was sind Immobilien?;immobilien;Immobilien Erklärung;
Was ist eine Liegenschaft?;immobilien;Immobilien Erklärung;
Was ist ein Grundstück?;immobilien;Immobilien Erklärung;
Soll ich in ein Haus investieren?;immobilien;Immobilien Erklärung;
Welche Arten von Immobilien gibt es?;immobilien;Immobilien Erklärung;
Ich möchte Land kaufen.;immobilien;Immobilien Erklärung;
Wie bestimme ich den Wert meiner Immobilie?;immobilien;Immobilien Erklärung;
Wie kann nich durch Immobilien einen Gewinn erzielen?;immobilien;Immobilien Erklärung;
Wie mache ich Gewinn mit Immobilien?;immobilien;Immobilien Erklärung;
Wie mache ich Gewinn mit einem Grundstück?;immobilien;Immobilien Erklärung;
Was ist ein Investmentfonds?;investmentfonds;Investmentfonds & ETFs;
Was ist ein ETF?;investmentfonds;Investmentfonds & ETFs;
Was ist ein Investmentfonds?;investmentfonds;Investmentfonds & ETFs;
Was sind Investmentfonds?;investmentfonds;Investmentfonds & ETFs;
Was sind ETFs?;investmentfonds;Investmentfonds & ETFs;
Was ist ein Exchange Traded Fund?;investmentfonds;Investmentfonds & ETFs;
Was sind ein Exchange Traded Funds?;investmentfonds;Investmentfonds & ETFs;
Was ist ein Fonds?;investmentfonds;Investmentfonds & ETFs;
Was sind Fonds?;investmentfonds;Investmentfonds & ETFs;
Ich möchte in Investmentfonds investieren.;investmentfonds;Investmentfonds & ETFs;
Ich möchte Investmentfonds kaufen.;investmentfonds;Investmentfonds & ETFs;
Ich möchte in Fonds investieren.;investmentfonds;Investmentfonds & ETFs;
Ich möchte Fonds kaufen.;investmentfonds;Investmentfonds & ETFs;
Ich möchte in ETFs investieren.;investmentfonds;Investmentfonds & ETFs;
Ich möchte ein ETF kaufen.;investmentfonds;Investmentfonds & ETFs;
Was ist Liquidität?;devisen;Liquidität Erklärung;
Was heisst es, wenn ein Finanzmittel liquid ist?;devisen;Liquidität Erklärung;
Was heisst es, wenn etwas liquid ist?;devisen;Liquidität Erklärung;
Wie viel Wert hat mein Grundbesitz?;immobilien;none;
Welche Art von Immobilien soll ich kaufen?;immobilien;none;
Welche Art von Grundstück soll ich kaufen?;immobilien;none;
Welche Art von Liegenschaft soll ich kaufen?;immobilien;none;
Welche Aktien sollte ich kaufen?;aktien;none;
Welche Aktien empfehlen Sie mir?;aktien;none;
Ich empfehle ihnen die Aktie von.;aktien;none;
Ich möchte nicht in Aktien investieren.;aktien;none;
Welche Vorteile haben Investitionen in Immobilien gegenüber anderen Investitionen?;immobilien;none;
Welchen Anteil meines Gesamtvermögens macht mein Grundeigentum aus?;immobilien;none;
Soll ich meine Liegenschaft verkaufen?;immobilien;none;
Wie viel Risiko soll ich eingehen?;risiko;none;
Was sind die grad?;derivate;none;
Ich möchte in die grad investieren.;derivate;none;
Ich möchte die grad kaufen.;derivate;none;
Was sind die rivat?;derivate;none;
Ich möchte in die rivat investieren.;derivate;none;
Ich möchte die rivat kaufen.;derivate;none;
Was sind Obligationen?;obligationen;Obligationen Erklärung;
Erklär mir Obligationen.;obligationen;Obligationen Erklärung;
Ich empfehle Ihnen Obligationen.;obligationen;Obligationen Erklärung;
Möchten Sie in Obligationen investieren?;obligationen;Obligationen Erklärung;
Ich möchte Obligationen kaufen.;obligationen;Obligationen Erklärung;
Was sind Anleihen?;obligationen;Obligationen Erklärung;
Was sind Bonds?;obligationen;Obligationen Erklärung;
Welche Kombination von Risiko und Rendite sollte ich nehmen?;risiko;Rendite-Risiko-Verhältnis;
Was meinen Sie mit Risikobereitschaft?;risiko;Rendite-Risiko-Verhältnis;
Wie sehen die Risiko Rendite Erwartungen aus?;risiko;Rendite-Risiko-Verhältnis;
Welche Kombination von Risiko und Rendite sollte ich nehmen?;risiko;Rendite-Risiko-Verhältnis;
Was ist das Risiko-Ertrags Verhältnis?;risiko;Rendite-Risiko-Verhältnis;
Was ist das Risiko-Renditen Verhältnis?;risiko;Rendite-Risiko-Verhältnis;
Was ist das Risiko-Gewinn Verhältnis?;risiko;Rendite-Risiko-Verhältnis;
Zeige mir ein Diagram zu Risiko und Rendite;risiko;Rendite-Risiko-Verhältnis;
Was ist ein Rendite-Risiko Diagram?;risiko;Rendite-Risiko-Verhältnis;
Was ist ein Rendite-Ertrags Diagram?;risiko;Rendite-Risiko-Verhältnis;
Was ist ein Rendite-Gewinn Diagram?;risiko;Rendite-Risiko-Verhältnis;
Wie hängen Rendite und Risiko zusammen?;risiko;Risiko Erklärung;
Erkläre mir wie Risiko und Rendite zusammenhängen.;risiko;Risiko Erklärung;
Wie hängen Risiko und Ertrag zusammen?;risiko;Risiko Erklärung;
Was ist mit Risiko gemeint?;risiko;Risiko Erklärung;
Wie hängen Risiko und Gewinn zusammen?;risiko;Risiko Erklärung;
Was ist das Risiko?;risiko;Risiko Erklärung;
Was ist Risiko?;risiko;Risiko Erklärung;
dphgj s'rnm'hnjhr 4'hbhj' dorfib;test;test;test
Wie kann ich Aktien kaufen?;aktien;Wie kaufe ich Aktien ein;
Wo kann ich Aktien kaufen?;aktien;Wie kaufe ich Aktien ein;
Von wem kann ich Aktien kaufen?;aktien;Wie kaufe ich Aktien ein;
